{
  "facts_file_version": "1.0",
  "domain": "hvac_efficiency_standards",
  "source_doc": "doe_final_rule_2017_cac_hp_efficiency.pdf",
  "source_title": "Energy Conservation Program: Energy Conservation Standards for Residential Central Air Conditioners and Heat Pumps \u2014 Direct Final Rule, 82 FR 1786 (January 6, 2017)",
  "curation": {
    "status": "verified",
    "method": "AI-assisted extraction with human-approved visual verification against every cited value, unit, page, and supporting quote.",
    "verified_by": "Alvin Alias",
    "verified_date": "2026-07-10"
  },
  "facts": [
    {
      "fact_id": "doe2017_ss_ac_lt45_national_seer2",
      "parameter": "Minimum SEER2 (national standard)",
      "entity": "Split-system air conditioners with certified cooling capacity < 45,000 Btu/h",
      "value": "13.4",
      "source_page": 63,
      "quote": "TABLE V-30\u2014AMENDED ENERGY CONSERVATION STANDARDS FOR CENTRAL AIR CONDITIONERS AND HEAT PUMPS AS DETERMINED BY THE NOVEMBER 2016 TEST PROCEDURE FINAL RULE",
      "keywords": [
        "45,000",
        "air",
        "btu",
        "capacity",
        "certified",
        "conditioners",
        "cooling",
        "minimum",
        "national",
        "seer2",
        "split",
        "system",
        "with"
      ],
      "unit": "SEER2",
      "qualifier": "National",
      "effective": "compliance required for units sold or imported on or after January 1, 2023",
      "source_section": "Table V-30",
      "notes": "Approximate extraction: value hand-transcribed from the table body; the two-column Federal Register text layer does not preserve row text verbatim. Verify against the table on the cited page."
    },
    {
      "fact_id": "doe2017_ss_ac_lt45_national_seer",
      "parameter": "Minimum SEER (national standard, pre-2016-test-procedure metric)",
      "entity": "Split-system air conditioners with certified cooling capacity < 45,000 Btu/h",
      "value": "14",
      "source_page": 63,
      "quote": "TABLE V-29\u2014AMENDED ENERGY CONSERVATION STANDARDS FOR CENTRAL AIR CONDITIONERS AND HEAT PUMPS AS DETERMINED BY THE DOE TEST PROCEDURE AT THE TIME OF THE 2015-2016 ASRAC NEGOTIATIONS",
      "keywords": [
        "45,000",
        "air",
        "btu",
        "capacity",
        "certified",
        "conditioners",
        "cooling",
        "minimum",
        "national",
        "seer",
        "split",
        "system",
        "with"
      ],
      "unit": "SEER",
      "qualifier": "National",
      "effective": "compliance required for units sold or imported on or after January 1, 2023",
      "source_section": "Table V-29",
      "notes": "Approximate extraction: value hand-transcribed from the table body; the two-column Federal Register text layer does not preserve row text verbatim. Verify against the table on the cited page."
    },
    {
      "fact_id": "doe2017_ss_ac_ge45_national_seer2",
      "parameter": "Minimum SEER2 (national standard)",
      "entity": "Split-system air conditioners with certified cooling capacity >= 45,000 Btu/h",
      "value": "13.4",
      "source_page": 63,
      "quote": "TABLE V-30\u2014AMENDED ENERGY CONSERVATION STANDARDS FOR CENTRAL AIR CONDITIONERS AND HEAT PUMPS AS DETERMINED BY THE NOVEMBER 2016 TEST PROCEDURE FINAL RULE",
      "keywords": [
        "45,000",
        "air",
        "btu",
        "capacity",
        "certified",
        "conditioners",
        "cooling",
        "minimum",
        "national",
        "seer2",
        "split",
        "system",
        "with"
      ],
      "unit": "SEER2",
      "qualifier": "National",
      "effective": "compliance required for units sold or imported on or after January 1, 2023",
      "source_section": "Table V-30",
      "notes": "Approximate extraction: value hand-transcribed from the table body; the two-column Federal Register text layer does not preserve row text verbatim. Verify against the table on the cited page."
    },
    {
      "fact_id": "doe2017_ss_ac_ge45_national_seer",
      "parameter": "Minimum SEER (national standard, pre-2016-test-procedure metric)",
      "entity": "Split-system air conditioners with certified cooling capacity >= 45,000 Btu/h",
      "value": "14",
      "source_page": 63,
      "quote": "TABLE V-29\u2014AMENDED ENERGY CONSERVATION STANDARDS FOR CENTRAL AIR CONDITIONERS AND HEAT PUMPS AS DETERMINED BY THE DOE TEST PROCEDURE AT THE TIME OF THE 2015-2016 ASRAC NEGOTIATIONS",
      "keywords": [
        "45,000",
        "air",
        "btu",
        "capacity",
        "certified",
        "conditioners",
        "cooling",
        "minimum",
        "national",
        "seer",
        "split",
        "system",
        "with"
      ],
      "unit": "SEER",
      "qualifier": "National",
      "effective": "compliance required for units sold or imported on or after January 1, 2023",
      "source_section": "Table V-29",
      "notes": "Approximate extraction: value hand-transcribed from the table body; the two-column Federal Register text layer does not preserve row text verbatim. Verify against the table on the cited page."
    },
    {
      "fact_id": "doe2017_ss_hp_national_seer2",
      "parameter": "Minimum SEER2 (national standard)",
      "entity": "Split-system heat pumps",
      "value": "14.3",
      "source_page": 63,
      "quote": "TABLE V-30\u2014AMENDED ENERGY CONSERVATION STANDARDS FOR CENTRAL AIR CONDITIONERS AND HEAT PUMPS AS DETERMINED BY THE NOVEMBER 2016 TEST PROCEDURE FINAL RULE",
      "keywords": [
        "heat",
        "minimum",
        "national",
        "pumps",
        "seer2",
        "split",
        "system"
      ],
      "unit": "SEER2",
      "qualifier": "National",
      "effective": "compliance required for units sold or imported on or after January 1, 2023",
      "source_section": "Table V-30",
      "notes": "Approximate extraction: value hand-transcribed from the table body; the two-column Federal Register text layer does not preserve row text verbatim. Verify against the table on the cited page."
    },
    {
      "fact_id": "doe2017_ss_hp_national_seer",
      "parameter": "Minimum SEER (national standard, pre-2016-test-procedure metric)",
      "entity": "Split-system heat pumps",
      "value": "15",
      "source_page": 63,
      "quote": "TABLE V-29\u2014AMENDED ENERGY CONSERVATION STANDARDS FOR CENTRAL AIR CONDITIONERS AND HEAT PUMPS AS DETERMINED BY THE DOE TEST PROCEDURE AT THE TIME OF THE 2015-2016 ASRAC NEGOTIATIONS",
      "keywords": [
        "heat",
        "minimum",
        "national",
        "pumps",
        "seer",
        "split",
        "system"
      ],
      "unit": "SEER",
      "qualifier": "National",
      "effective": "compliance required for units sold or imported on or after January 1, 2023",
      "source_section": "Table V-29",
      "notes": "Approximate extraction: value hand-transcribed from the table body; the two-column Federal Register text layer does not preserve row text verbatim. Verify against the table on the cited page."
    },
    {
      "fact_id": "doe2017_ss_hp_national_hspf2",
      "parameter": "Minimum HSPF2 (national standard)",
      "entity": "Split-system heat pumps",
      "value": "7.5",
      "source_page": 63,
      "quote": "TABLE V-30\u2014AMENDED ENERGY CONSERVATION STANDARDS FOR CENTRAL AIR CONDITIONERS AND HEAT PUMPS AS DETERMINED BY THE NOVEMBER 2016 TEST PROCEDURE FINAL RULE",
      "keywords": [
        "heat",
        "heating",
        "hspf2",
        "minimum",
        "national",
        "pumps",
        "split",
        "system"
      ],
      "unit": "HSPF2",
      "qualifier": "National",
      "effective": "compliance required for units sold or imported on or after January 1, 2023",
      "source_section": "Table V-30",
      "notes": "Approximate extraction: value hand-transcribed from the table body; the two-column Federal Register text layer does not preserve row text verbatim. Verify against the table on the cited page."
    },
    {
      "fact_id": "doe2017_ss_hp_national_hspf",
      "parameter": "Minimum HSPF (national standard, pre-2016-test-procedure metric)",
      "entity": "Split-system heat pumps",
      "value": "8.8",
      "source_page": 63,
      "quote": "TABLE V-29\u2014AMENDED ENERGY CONSERVATION STANDARDS FOR CENTRAL AIR CONDITIONERS AND HEAT PUMPS AS DETERMINED BY THE DOE TEST PROCEDURE AT THE TIME OF THE 2015-2016 ASRAC NEGOTIATIONS",
      "keywords": [
        "heat",
        "heating",
        "hspf",
        "minimum",
        "national",
        "pumps",
        "split",
        "system"
      ],
      "unit": "HSPF",
      "qualifier": "National",
      "effective": "compliance required for units sold or imported on or after January 1, 2023",
      "source_section": "Table V-29",
      "notes": "Approximate extraction: value hand-transcribed from the table body; the two-column Federal Register text layer does not preserve row text verbatim. Verify against the table on the cited page."
    },
    {
      "fact_id": "doe2017_sp_ac_national_seer2",
      "parameter": "Minimum SEER2 (national standard)",
      "entity": "Single-package air conditioners",
      "value": "13.4",
      "source_page": 64,
      "quote": "TABLE V-30\u2014AMENDED ENERGY CONSERVATION STANDARDS FOR CENTRAL AIR CONDITIONERS AND HEAT PUMPS AS DETERMINED BY THE NOVEMBER 2016 TEST PROCEDURE FINAL RULE",
      "keywords": [
        "air",
        "conditioners",
        "minimum",
        "national",
        "package",
        "seer2",
        "single"
      ],
      "unit": "SEER2",
      "qualifier": "National",
      "effective": "compliance required for units sold or imported on or after January 1, 2023",
      "source_section": "Table V-30",
      "notes": "Approximate extraction: value hand-transcribed from the table body; the two-column Federal Register text layer does not preserve row text verbatim. Verify against the table on the cited page."
    },
    {